{
    "id": "abilities_demo",
    "name": "Abilities Demo",
    "version": "1.0",
    "author": "Framework",
    "description": "Dash + double jump built entirely on the World Control API (mod.game.world). Local-first; auto-disables online.",
    "api_version": 1,
    "entry": "main.lua",
    "config": "config.cfg"
}
